id,source,content
Japan_1,Japan,"Japan is an island nation in East Asia, known for its unique blend of ancient traditions and cutting-edge technology. It has a rich cultural heritage, including tea ceremonies, sumo wrestling, and kabuki theater. Geographically, Japan consists of four main islands and numerous smaller ones, featuring mountains, forests, and a rugged coastline. Mount Fuji is its most iconic peak. Major cities include Tokyo, Kyoto, and Osaka, each offering distinct experiences from historical temples to modern sky"
Japan_2,Japan,scrapers.
Taiwan_1,Taiwan,"Taiwan is an island located off the southeastern coast of China, known for its vibrant night markets, lush mountains, and rich history. It blends Chinese, Japanese, and indigenous influences in its culture. Taipei, the capital, is home to the towering Taipei 101 and the famous National Palace Museum. Taroko Gorge and Sun Moon Lake are among Taiwan’s most stunning natural attractions."
Thailand_1,Thailand,"Thailand is a Southeast Asian country famous for its tropical beaches, ornate temples, and bustling street food culture. Bangkok, the capital, is known for its vibrant nightlife and historical sites like the Grand Palace and Wat Arun. Northern Thailand features mountainous landscapes and cultural cities like Chiang Mai, while the south offers world-renowned islands such as Phuket and Koh Samui."
South_Korea_1,South_Korea,"South Korea is a dynamic country in East Asia, blending modern urban life with deep-rooted traditions. Seoul, the capital, is a global technology hub and home to historical landmarks like Gyeongbokgung Palace. The country is famous for K-pop, Korean BBQ, and hanbok (traditional clothing). Natural attractions include Jeju Island’s volcanic landscapes and the scenic countryside of Boseong."
Vietnam_1,Vietnam,"Vietnam is a Southeast Asian country known for its rich history, diverse landscapes, and delicious cuisine. Hanoi and Ho Chi Minh City are its major urban centers, each with a unique character. Ha Long Bay’s limestone karsts and the Mekong Delta’s floating markets are famous geographical highlights. Vietnamese culture is deeply influenced by Confucian values, French colonial heritage, and indigenous traditions."
Philippines_1,Philippines,"The Philippines is an archipelago of over 7,000 islands in Southeast Asia, known for its stunning beaches, vibrant festivals, and hospitable people. Manila, the capital, is a mix of modern skyscrapers and Spanish colonial architecture. The country is famous for destinations like Boracay, Palawan, and the Chocolate Hills of Bohol. Filipino culture is influenced by Malay, Spanish, and American traditions."
Malaysia_1,Malaysia,"Malaysia is a diverse country in Southeast Asia, divided into Peninsular Malaysia and Malaysian Borneo. Kuala Lumpur, the capital, features the iconic Petronas Towers. The country is known for its multicultural society, rainforests, and beautiful islands such as Langkawi. Malaysian cuisine blends Malay, Chinese, and Indian influences, making it one of the most flavorful in the region."
Indonesia_1,Indonesia,"Indonesia is the world’s largest archipelago, consisting of over 17,000 islands, including Java, Sumatra, and Bali. The country is known for its rich cultural diversity, with influences from Hinduism, Islam, and indigenous traditions. Bali is a popular tourist destination, famous for its temples, rice terraces, and beaches. Jakarta, the capital, is a bustling metropolis with a mix of modern and historical sites."
Mongolia_1,Mongolia,"Mongolia, while geographically in East Asia, has a culture that is distinct from its neighbors. It is known for its vast steppes, nomadic traditions, and historical connection to Genghis Khan. Ulaanbaatar, the capital, serves as the country’s cultural and economic center. The Naadam Festival, featuring horse racing, wrestling, and archery, showcases Mongolia’s rich heritage."
